{"bundle_id":"odis-fixture-bundle","bundle_version":"0.1.0","families":{"jira-prod":{"default_mode":"strict","policy":"package odis_policy\n\ndefault decision := {\"decision\": \"deny\", \"obligations\": {}}\n","tools":{"update_issue":{"action_limits":{"allowed_fields":["labels"]}}},"vendor_mcp":{"endpoint_id":"jira-prod-mcp-v1","url":"https://jira-prod-mcp.internal:8443/"}}},"trust_root_id":"fixture-trust-root"}